{
	"name": "fooBar",
	"version": "1.0.0",
	"description": "This is foobar's description.",
	"keywords": [ "foo", "bar", "foobar" ],
	"homepage": "https://github.com/foo/bar",
	"release-date": "2019-07-09",
	"type": "library",
	"notification-url": "http://github.com/notification",
	"require": {
		"foo": "^1.0",
		"bar": "~2.2"
	},
	"require-dev": {
		"foo-dev": "^1.0",
		"bar-dev": "~2.2"
	},
	"replace": {
		"foo-replace": "1.6"
	},
	"provide": {
		"foo-provide": "1.2"
	},
	"conflict": {
		"bar-conflict": "2.7"
	},
	"suggest": {
		"bar": "bar-suggest"
	},
	"support": {
		"issues": "https://github.com/foo/bar/issues",
		"email": "foo@support.com"
	},
	"authors": [
		{
			"name": "foo"
		}
	],
	"license": [ "mit" ],
	"deprecated": false,
	"archive": [ "release/" ],
	"extra": {
		"plugin": [ "foo/bar" ]
	},
	"bin": [ "bin/" ],
	"scripts": {
		"foo": "bar",
		"aux" : "auux"
	}
}
